Item Title;Publication Title;Book Series Title;Journal Volume;Journal Issue;Item DOI;Authors;Publication Year;URL;Content Type
ODSA: Chord-Based Object Discovery Service Architecture for the Internet of Things;Wireless Personal Communications;;73;4;10.1007/s11277-013-1260-3;De-Gang XuLei-Hua QinJong-Hyuk ParkJing-Li Zhou;2013;http://link.springer.com/article/10.1007/s11277-013-1260-3;Article
Official statistics in the era of big data opportunities and threats;International Journal of Data Science and Analytics;;;;10.1007/s41060-018-0124-z;Walter J. Radermacher;2018;http://link.springer.com/article/10.1007/s41060-018-0124-z;Article
On legal contracts, imperative and declarative smart contracts, and blockchain systems;Artificial Intelligence and Law;;;;10.1007/s10506-018-9223-3;Guido GovernatoriFlorian IdelbergerZoran MilosevicRegis RiveretGiovanni SartorXiwei Xu;2018;http://link.springer.com/article/10.1007/s10506-018-9223-3;Article
On the Effect of Previous Technological Experience on the Usability of a Virtual Rehabilitation Tool for the Physical Activation and Cognitive Stimulation of Elders;Journal of Medical Systems;;39;9;10.1007/s10916-015-0297-0;Alberto L. MoránCristina Ramírez-FernándezVictoria Meza-KuboFelipe Orihuela-EspinaEloísa García-CansecoAna I. GrimaldoEnrique Sucar;2015;http://link.springer.com/article/10.1007/s10916-015-0297-0;Article
On the Internet of Things, smart cities and the WHO Healthy Cities;International Journal of Health Geographics;;13;1;10.1186/1476-072X-13-10;Maged N Kamel BoulosNajeeb M Al-Shorbaji;2014;http://link.springer.com/article/10.1186/1476-072X-13-10;Article
On the Virtualization of CUDA Based GPU Remoting on ARM and X86 Machines in the GVirtuS Framework;International Journal of Parallel Programming;;45;5;10.1007/s10766-016-0462-1;Raffaele MontellaGiulio GiuntaGiuliano LaccettiMarco LapegnaCarlo PalmieriCarmine FerraroValentina PellicciaCheol-Ho HongIvor SpenceDimitrios S. Nikolopoulos;2017;http://link.springer.com/article/10.1007/s10766-016-0462-1;Article
On thinging things and serving services: technological mediation and inseparable goods;Ethics and Information Technology;;15;3;10.1007/s10676-013-9317-2;Wolter Pieters;2013;http://link.springer.com/article/10.1007/s10676-013-9317-2;Article
Online low-field NMR spectroscopy for process control of an industrial lithiation reaction—automated data analysis;Analytical and Bioanalytical Chemistry;;410;14;10.1007/s00216-018-1020-z;Simon KernKlas MeyerSvetlana GuhlPatrick GräßerAndrea PaulRudibert KingMichael Maiwald;2018;http://link.springer.com/article/10.1007/s00216-018-1020-z;Article
Ontology for cloud manufacturing based Product Lifecycle Management;Journal of Intelligent Manufacturing;;;;10.1007/s10845-017-1376-5;Asma TalhiVirginie FortineauJean-Charles HuetSamir Lamouri;2017;http://link.springer.com/article/10.1007/s10845-017-1376-5;Article
Open Research in Business and Information Systems Engineering;Business & Information Systems Engineering;;58;6;10.1007/s12599-016-0454-0;Prof. Dr. ir. Wil van der AalstProf. Dr. Martin BichlerProf. Dr. Armin Heinzl;2016;http://link.springer.com/article/10.1007/s12599-016-0454-0;Article
Open geospatial data, software and standards;Open Geospatial Data, Software and Standards;;1;1;10.1186/s40965-016-0004-1;Mohamed BakillahSteve Liang;2016;http://link.springer.com/article/10.1186/s40965-016-0004-1;Article
Opening discussion on banking sector risk exposures and vulnerabilities from Virtual currencies: An Operational Risk perspective;Journal of Banking Regulation;;17;4;10.1057/jbr.2015.10;Gareth W PetersAriane ChapelleEfstathios Panayi;2016;http://link.springer.com/article/10.1057/jbr.2015.10;Article
Opening science: towards an agenda of open science in academia and industry;The Journal of Technology Transfer;;40;4;10.1007/s10961-014-9375-6;Sascha FriesikeBastian WidenmayerOliver GassmannThomas Schildhauer;2015;http://link.springer.com/article/10.1007/s10961-014-9375-6;Article
Optimization technology in cloud manufacturing;The International Journal of Advanced Manufacturing Technology;;;;10.1007/s00170-018-1991-0;Liang GuoJingxiong Qiu;2018;http://link.springer.com/article/10.1007/s00170-018-1991-0;Article
Optomechanical sensing with on-chip microcavities;Frontiers of Physics;;8;5;10.1007/s11467-013-0384-y;Yi-Wen HuYun-Feng XiaoYong-Chun LiuQihuang Gong;2013;http://link.springer.com/article/10.1007/s11467-013-0384-y;Article
Overview of BISE Articles Published in 2009, 2010, 2011, and 2012;Business & Information Systems Engineering;;5;1;10.1007/s12599-013-0251-y;;2013;http://link.springer.com/article/10.1007/s12599-013-0251-y;Article
Overview of State Policies for Energy Efficiency in Buildings;Current Sustainable/Renewable Energy Reports;;5;1;10.1007/s40518-018-0100-1;Yu Wang;2018;http://link.springer.com/article/10.1007/s40518-018-0100-1;Article
Overview of business innovations and research opportunities in blockchain and introduction to the special issue;Financial Innovation;;2;1;10.1186/s40854-016-0049-2;J. Leon ZhaoShaokun FanJiaqi Yan;2016;http://link.springer.com/article/10.1186/s40854-016-0049-2;Article
PPAP, Ericcson / Omron / Inteva, Supreme Treon / Mahindra Reva Electric / Comsol, NI / Integer, iCAT;Auto Tech Review;;5;11;10.1365/s40112-016-1230-8;;2016;http://link.springer.com/article/10.1365/s40112-016-1230-8;Article
Paper-based magnetics: matching paper with permalloy;Cellulose;;23;5;10.1007/s10570-016-1019-6;Meriem AkinMatthew SteggemanLutz Rissing;2016;http://link.springer.com/article/10.1007/s10570-016-1019-6;Article
Participative marketing: extending social media marketing through the identification and interaction capabilities from the Internet of things;Personal and Ubiquitous Computing;;18;4;10.1007/s00779-013-0714-7;Antonio J. JaraMaría Concepción ParraAntonio F. Skarmeta;2014;http://link.springer.com/article/10.1007/s00779-013-0714-7;Article
Passive secret disclosure attack on an ultralightweight authentication protocol for Internet of Things;The Journal of Supercomputing;;73;8;10.1007/s11227-017-1959-0;Masoumeh SafkhaniNasour Bagheri;2017;http://link.springer.com/article/10.1007/s11227-017-1959-0;Article
Patient-centered activity monitoring in the self-management of chronic health conditions;BMC Medicine;;13;1;10.1186/s12916-015-0319-2;Emil ChiauzziCarlos RodartePronabesh DasMahapatra;2015;http://link.springer.com/article/10.1186/s12916-015-0319-2;Article
Peer-to-peer as an infrastructure service;Peer-to-Peer Networking and Applications;;7;4;10.1007/s12083-014-0252-8;Jiangchuan LiuKe XuYongqiang XiongDongchao MaKai Shuang;2014;http://link.springer.com/article/10.1007/s12083-014-0252-8;Article
Performance analysis of data intensive cloud systems based on data management and replication: a survey;Distributed and Parallel Databases;;34;2;10.1007/s10619-015-7173-2;Saif Ur Rehman MalikSamee U. KhanSam J. EwenNikos TziritasJoanna KolodziejAlbert Y. ZomayaSajjad A. MadaniNasro Min-AllahLizhe WangCheng-Zhong XuQutaibah Marwan MalluhiJohnatan E. PeceroPavan BalajiAbhinav VishnuRajiv RanjanSherali Zeadally;2016;http://link.springer.com/article/10.1007/s10619-015-7173-2;Article
Performance evaluation of waste electrical and electronic equipment disassembly layout configurations using simulation;Frontiers of Environmental Science & Engineering;;11;5;10.1007/s11783-017-0992-9;Ozan CaprazOlcay PolatAskiner Gungor;2017;http://link.springer.com/article/10.1007/s11783-017-0992-9;Article
Personal control of privacy and data: Estonian experience;Health and Technology;;7;4;10.1007/s12553-017-0195-1;Jaan PriisaluRain Ottis;2017;http://link.springer.com/article/10.1007/s12553-017-0195-1;Article
Personal data: how context shapes consumers’ data sharing with organizations from various sectors;Electronic Markets;;25;2;10.1007/s12525-015-0183-0;Bjoern RoeberOlaf RehseRobert KnorrekBenjamin Thomsen;2015;http://link.springer.com/article/10.1007/s12525-015-0183-0;Article
Place branding strategies in the context of new smart cities: Songdo IBD, Masdar and Skolkovo;Place Branding and Public Diplomacy;;14;2;10.1057/s41254-017-0078-2;Olga KolotouchkinaGildo Seisdedos;2018;http://link.springer.com/article/10.1057/s41254-017-0078-2;Article
Placing Humans in the Feedback Loop of Social Infrastructures;Informatik-Spektrum;;36;6;10.1007/s00287-013-0735-7;Günter MüllerWolfgang Wahlster;2013;http://link.springer.com/article/10.1007/s00287-013-0735-7;Article
Playfulness, ideology and the technology of foolishness in the creation of a novel market niche for distributed control: The case of iPLON;Journal of Organization Design;;5;1;10.1186/s41469-016-0008-4;Annachiara CasaliniGuido FiorettiAndreas Pyka;2016;http://link.springer.com/article/10.1186/s41469-016-0008-4;Article
Political and social trends in the future of global security. A meta-study on official perspectives in Europe and North America;European Journal of Futures Research;;5;1;10.1007/s40309-017-0120-x;Javier Jordan;2017;http://link.springer.com/article/10.1007/s40309-017-0120-x;Article
Potentials of additive manufacturing with smart materials for chemical biomarkers in wearable applications;International Journal of Precision Engineering and Manufacturing-Green Technology;;4;3;10.1007/s40684-017-0039-5;JuYoun KwonHyung Wook ParkYoung-Bin ParkNamhun Kim;2017;http://link.springer.com/article/10.1007/s40684-017-0039-5;Article
Predictive maintenance: strategic use of IT in manufacturing organizations;Information Systems Frontiers;;;;10.1007/s10796-017-9749-z;Salvatore T. MarchGary D. Scudder;2017;http://link.springer.com/article/10.1007/s10796-017-9749-z;Article
Preface to the special issue on ubiquitous user modeling and user-adapted interaction;User Modeling and User-Adapted Interaction;;25;3;10.1007/s11257-015-9163-5;Tsvi KuflikJudy KayAaron Quigley;2015;http://link.springer.com/article/10.1007/s11257-015-9163-5;Article
Preface;Journal of Computer Science and Technology;;29;4;10.1007/s11390-014-1448-3;Ke LiuZhi-Yong Liu;2014;http://link.springer.com/article/10.1007/s11390-014-1448-3;Article
Presenting Cloud Business Performance for Manufacturing Organizations;Information Systems Frontiers;;;;10.1007/s10796-017-9798-3;Victor Chang;2017;http://link.springer.com/article/10.1007/s10796-017-9798-3;Article
Preserving privacy in internet of things: a survey;International Journal of Information Technology;;10;2;10.1007/s41870-018-0113-4;Adnan Ahmed Abi SenFathy Albouraey EassaKamal JambiMohammad Yamin;2018;http://link.springer.com/article/10.1007/s41870-018-0113-4;Article
Privacy online: up, close and personal;Health and Technology;;7;4;10.1007/s12553-017-0197-z;Eneken Tikk;2017;http://link.springer.com/article/10.1007/s12553-017-0197-z;Article
Privacy-Preserving Public Auditing for Non-manager Group Shared Data;Wireless Personal Communications;;;;10.1007/s11277-018-5634-4;Longxia HuangGongxuan ZhangAnmin Fu;2018;http://link.springer.com/article/10.1007/s11277-018-5634-4;Article
Privacy-preserving blockchain-based electric vehicle charging with dynamic tariff decisions;Computer Science - Research and Development;;33;01/fev;10.1007/s00450-017-0348-5;Fabian KnirschAndreas UnterwegerDominik Engel;2018;http://link.springer.com/article/10.1007/s00450-017-0348-5;Article
Privacy-preserving identity-based file sharing in smart city;Personal and Ubiquitous Computing;;21;5;10.1007/s00779-017-1051-z;Xiling LuoYili RenJiankun HuQianhong WuJungang Lou;2017;http://link.springer.com/article/10.1007/s00779-017-1051-z;Article
ProMeTA: a taxonomy for program metamodels in program reverse engineering;Empirical Software Engineering;;;;10.1007/s10664-017-9592-3;Hironori WashizakiYann-Gaël GuéhéneucFoutse Khomh;2018;http://link.springer.com/article/10.1007/s10664-017-9592-3;Article
Process analytics in science and industry;Analytical and Bioanalytical Chemistry;;409;3;10.1007/s00216-016-0104-x;Rudolf W. Kessler;2017;http://link.springer.com/article/10.1007/s00216-016-0104-x;Article
Product-Centric Simulation-Based Design for Recycling: Case of LED Lamp Recycling;Journal of Sustainable Metallurgy;;1;1;10.1007/s40831-014-0006-0;M. A. ReuterA. van Schaik;2015;http://link.springer.com/article/10.1007/s40831-014-0006-0;Article
Proposal, project, practice, pause: Developing a framework for evaluating smart domestic product engagement;AMS Review;;;;10.1007/s13162-017-0089-4;Tony WoodallJulie RosboroughJohn Harvey;2017;http://link.springer.com/article/10.1007/s13162-017-0089-4;Article
Provably secure biometric based authentication and key agreement protocol for wireless sensor networks;Journal of Ambient Intelligence and Humanized Computing;;;;10.1007/s12652-017-0474-8;Jangirala SrinivasDheerendra MishraSourav MukhopadhyaySaru Kumari;2017;http://link.springer.com/article/10.1007/s12652-017-0474-8;Article
Proving ground for social network analysis in the emerging research area “Internet of Things” (IoT);Scientometrics;;109;1;10.1007/s11192-016-1931-4;Arif MehmoodGyu Sang ChoiOtto F. von FeigenblattHan Woo Park;2016;http://link.springer.com/article/10.1007/s11192-016-1931-4;Article
Public IT service strategy for social information security in the intelligence all-things environment;Electronic Commerce Research;;14;3;10.1007/s10660-014-9155-2;Jinho YooHangbae Chang;2014;http://link.springer.com/article/10.1007/s10660-014-9155-2;Article
Quality characteristics and measures for human–computer interaction evaluation in ubiquitous systems;Software Quality Journal;;25;3;10.1007/s11219-016-9320-z;Rainara Maia CarvalhoRossana Maria de Castro AndradeKáthia Marçal de OliveiraIsmayle de Sousa SantosCarla Ilane Moreira Bezerra;2017;http://link.springer.com/article/10.1007/s11219-016-9320-z;Article
Quality of service optimization in solar cells-based energy harvesting wireless sensor networks;Energy Efficiency;;10;2;10.1007/s12053-016-9458-3;Soledad EscolarStefano ChessaJesús Carretero;2017;http://link.springer.com/article/10.1007/s12053-016-9458-3;Article
RETRACTED ARTICLE: An approach to evaluate the effects of virtual topology on in-band crosstalk attack propagation in transparent optical networks;Photonic Network Communications;;24;2;10.1007/s11107-011-0362-7;Yonghua XiaoYunfeng PengZeyu SunChangming ZhaoKeping Long;2012;http://link.springer.com/article/10.1007/s11107-011-0362-7;Article
RFID in production and service systems: Technology, applications and issues;Information Systems Frontiers;;17;6;10.1007/s10796-014-9518-1;Nilgun Fescioglu-UnverSung Hee ChoiDongmok SheenSoundar Kumara;2015;http://link.springer.com/article/10.1007/s10796-014-9518-1;Article
Radiofrequency Identification and Surface Acoustic Wave Technologies for Developing the Food Intelligent Packaging Concept;Food Engineering Reviews;;7;1;10.1007/s12393-014-9102-y;Antonio López-GómezFernando Cerdán-CartagenaJuan Suardíaz-MuroMaría Boluda-AguilarMaría Esther Hernández-HernándezMaría Angeles López-SerranoJuan López-Coronado;2015;http://link.springer.com/article/10.1007/s12393-014-9102-y;Article
Real-time data-driven monitoring in job-shop floor based on radio frequency identification;The International Journal of Advanced Manufacturing Technology;;92;05/ago;10.1007/s00170-017-0248-7;Wei CaoPingyu JiangPing LuBin LiuKaiyong Jiang;2017;http://link.springer.com/article/10.1007/s00170-017-0248-7;Article
Real-time grouting monitoring and visualization analysis system for dam foundation curtain grouting;Transactions of Tianjin University;;22;6;10.1007/s12209-016-2794-8;Guichao Fan ???Denghua Zhong ???Bingyu Ren ???Bo Cui ? ?Xiaochao Li ???Pan Yue ? ?;2016;http://link.springer.com/article/10.1007/s12209-016-2794-8;Article
Realising next-generation web service-driven industrial systems;The International Journal of Advanced Manufacturing Technology;;60;01/abr;10.1007/s00170-011-3612-z;Stamatis Karnouskos;2012;http://link.springer.com/article/10.1007/s00170-011-3612-z;Article
Realising the right to data portability for the domestic Internet of things;Personal and Ubiquitous Computing;;22;2;10.1007/s00779-017-1069-2;Lachlan UrquhartNeelima SailajaDerek McAuley;2018;http://link.springer.com/article/10.1007/s00779-017-1069-2;Article
Recent progress in low temperature nanoimprint lithography;Microsystem Technologies;;21;1;10.1007/s00542-014-2366-6;Hongwen Sun;2015;http://link.springer.com/article/10.1007/s00542-014-2366-6;Article
Recharging versus replacing sensor nodes using mobile robots for network maintenance;Telecommunication Systems;;63;4;10.1007/s11235-016-0145-7;Leonardo MilitanoMilan ErdeljAntonella MolinaroNathalie MittonAntonio Iera;2016;http://link.springer.com/article/10.1007/s11235-016-0145-7;Article
Reconfigurable manufacturing systems: journey and the road ahead;International Journal of System Assurance Engineering and Management;;8;2;10.1007/s13198-017-0610-z;Ashutosh SinghShashank GuptaMohammad AsjadPiyush Gupta;2017;http://link.springer.com/article/10.1007/s13198-017-0610-z;Article
Reducing Power Consumption of Wireless Networks Through Collaborative DMC Mobile Clusters;Wireless Personal Communications;;98;2;10.1007/s11277-017-4944-2;Arash OstovarZheng Chang;2018;http://link.springer.com/article/10.1007/s11277-017-4944-2;Article
Reflections on customer-based brand equity: perspectives, progress, and priorities;AMS Review;;6;01/fev;10.1007/s13162-016-0078-z;Kevin Lane Keller;2016;http://link.springer.com/article/10.1007/s13162-016-0078-z;Article
Reflections on networks, human behaviour, and social dynamics in the digital age;AI & SOCIETY;;33;2;10.1007/s00146-017-0704-9;Theodore TsekerisCharalambos TsekerisIoannis Katerelos;2018;http://link.springer.com/article/10.1007/s00146-017-0704-9;Article
Regulation of Big Data: Perspectives on strategy, policy, law and privacy;Health and Technology;;7;4;10.1007/s12553-017-0190-6;Pompeu CasanovasLouis De KokerDanuta MendelsonDavid Watts;2017;http://link.springer.com/article/10.1007/s12553-017-0190-6;Article
Relay selection for secure 5G green communications;Telecommunication Systems;;59;1;10.1007/s11235-014-9890-7;Nikolaos NomikosAna NietoProdromos MakrisDimitrios N. SkoutasDemosthenes VouyioukasPanagiotis RizomiliotisJavier LopezCharalambos Skianis;2015;http://link.springer.com/article/10.1007/s11235-014-9890-7;Article
Reliability Issues and Solutions in Flexible Electronics Under Mechanical Fatigue;Electronic Materials Letters;;;;10.1007/s13391-018-0043-0;Seol-Min YiIn-Suk ChoiByoung-Joon KimYoung-Chang Joo;2018;http://link.springer.com/article/10.1007/s13391-018-0043-0;Article
Reliability and human factors in Ambient Assisted Living environments;Journal of Reliable Intelligent Environments;;3;3;10.1007/s40860-017-0042-1;Filippo PalumboDavide La RosaErina FerroDavide BacciuClaudio GallicchioAlessio MicheliStefano ChessaFederico VozziOberdan Parodi;2017;http://link.springer.com/article/10.1007/s40860-017-0042-1;Article
Reliable Communication Networks for Smart Grid Transmission Systems;Journal of Network and Systems Management;;24;3;10.1007/s10922-016-9375-y;Velin KounevMartin LévesqueDavid TipperTeresa Gomes;2016;http://link.springer.com/article/10.1007/s10922-016-9375-y;Article
Remanufacturing in industry: advices from the field;The International Journal of Advanced Manufacturing Technology;;86;09/dez;10.1007/s00170-016-8346-5;Idiano D’AdamoPaolo Rosa;2016;http://link.springer.com/article/10.1007/s00170-016-8346-5;Article
Report;Datenschutz und Datensicherheit - DuD;;41;8;10.1007/s11623-017-0823-y;;2017;http://link.springer.com/article/10.1007/s11623-017-0823-y;Article
Research Challenges, Trends and Applications for Multi-Sensory Devices in Future Networked Systems;Wireless Personal Communications;;95;1;10.1007/s11277-017-4426-6;Liljana GavrilovskaValentin RakovicVladimir Atanasovski;2017;http://link.springer.com/article/10.1007/s11277-017-4426-6;Article
Research Driven Clusters at the Heart of (Trans-)Regional Learning and Priority-Setting Processes;Journal of the Knowledge Economy;;5;1;10.1007/s13132-014-0180-0;Günter ClarBjörn Sautter;2014;http://link.springer.com/article/10.1007/s13132-014-0180-0;Article
Research advance in wireless networks and mobile computing;Telecommunication Systems;;60;1;10.1007/s11235-014-9916-1;Liang ZhouHonggang WangYi Qian;2015;http://link.springer.com/article/10.1007/s11235-014-9916-1;Article
Research on Monitoring Platform of Agricultural Product Circulation Efficiency Supported by Cloud Computing;Wireless Personal Communications;;;;10.1007/s11277-018-5392-3;Chen JinboZhong YuAnthony Lam;2018;http://link.springer.com/article/10.1007/s11277-018-5392-3;Article
Research on agricultural products supply chain inspection system based on internet of things;Cluster Computing;;;;10.1007/s10586-018-2021-6;Kaijun LengLinbo JinWen ShiInneke Van Nieuwenhuyse;2018;http://link.springer.com/article/10.1007/s10586-018-2021-6;Article
Research on initiative scheduling mode for a physical internet-based manufacturing system;The International Journal of Advanced Manufacturing Technology;;84;01/abr;10.1007/s00170-015-7915-3;Jun-qiang WangGuo-qiang FanFei-yi YanYing-feng ZhangShu-dong Sun;2016;http://link.springer.com/article/10.1007/s00170-015-7915-3;Article
Research on real time feature extraction method for complex manufacturing big data;The International Journal of Advanced Manufacturing Technology;;;;10.1007/s00170-016-9864-x;Xianguang KongJiantao ChangMeng NiuXiaoyu HuangJihu WangShing I. Chang;2016;http://link.springer.com/article/10.1007/s00170-016-9864-x;Article
Rethinking the architecture design of data center networks;Frontiers of Computer Science;;6;5;10.1007/s11704-012-1155-6;Kaishun WuJiang XiaoLionel M. Ni;2012;http://link.springer.com/article/10.1007/s11704-012-1155-6;Article
Review on MANET Based Communication for Search and Rescue Operations;Wireless Personal Communications;;94;1;10.1007/s11277-015-3155-y;Shaik Shabana AnjumRafidah Md. NoorMohammad Hossein Anisi;2017;http://link.springer.com/article/10.1007/s11277-015-3155-y;Article
Rich Device-Services (RDS): A Service-Oriented Approach to the Internet of Things (IoT);Wireless Personal Communications;;97;2;10.1007/s11277-017-4669-2;Saeed ShokrollahiFereidoon Shams;2017;http://link.springer.com/article/10.1007/s11277-017-4669-2;Article
Risk assessment of remanufacturing arm structure for crane based on potential failure mode;Journal of Mechanical Science and Technology;;29;12;10.1007/s12206-015-1136-4;Qing DongGening XuHuili Ren;2015;http://link.springer.com/article/10.1007/s12206-015-1136-4;Article
Road to a reactive and incremental model transformation platform: three generations of the VIATRA framework;Software & Systems Modeling;;15;3;10.1007/s10270-016-0530-4;Dániel VarróGábor BergmannÁbel HegedüsÁkos HorváthIstván RáthZoltán Ujhelyi;2016;http://link.springer.com/article/10.1007/s10270-016-0530-4;Article
Robert Bosch Gmbh — Looking Beyond The Hood;Auto Tech Review;;4;6;10.1365/s40112-015-0931-8;;2015;http://link.springer.com/article/10.1365/s40112-015-0931-8;Article
Roundtable: Research Opportunities and Challenges for Emerging Software Systems;Journal of Computer Science and Technology;;30;5;10.1007/s11390-015-1572-8;Xiangyu ZhangDongmei ZhangYves Le TraonQing WangLu Zhang;2015;http://link.springer.com/article/10.1007/s11390-015-1572-8;Article
Rule-based tools for the configuration of ambient intelligence systems: a comparative user study;Multimedia Tools and Applications;;76;4;10.1007/s11042-016-3511-2;Federico CabitzaDaniela FogliRosa LanzilottiAntonio Piccinno;2017;http://link.springer.com/article/10.1007/s11042-016-3511-2;Article
SLAP: Succinct and Lightweight Authentication Protocol for low-cost RFID system;Wireless Networks;;24;1;10.1007/s11276-016-1323-y;Hanguang LuoGuangjun WenJian SuZhong Huang;2018;http://link.springer.com/article/10.1007/s11276-016-1323-y;Article
Safety in Embedded Software Challenges in Growing from Rapid Rising of Third-Party Code;ATZelektronik worldwide;;11;1;10.1007/s38314-015-0572-3;André GirardChris Rommel;2016;http://link.springer.com/article/10.1007/s38314-015-0572-3;Article
Science mapping approach to analyze the research evolution on precision agriculture: world, EU and Italian situation;Precision Agriculture;;;;10.1007/s11119-018-9569-2;Federico PallottinoMarcello BioccaPierfrancesco NardiSimone FigorilliPaolo MenesattiCorrado Costa;2018;http://link.springer.com/article/10.1007/s11119-018-9569-2;Article
Scientific literature analysis on big data and internet of things applications on circular economy: a bibliometric study;Scientometrics;;111;1;10.1007/s11192-017-2281-6;Gustavo Cattelan NobreElaine Tavares;2017;http://link.springer.com/article/10.1007/s11192-017-2281-6;Article
Secure ultra-lightweight RFID mutual authentication protocol based on transparent computing for IoV;Peer-to-Peer Networking and Applications;;11;4;10.1007/s12083-017-0553-9;Kai FanWei WangWei JiangHui LiYintang Yang;2018;http://link.springer.com/article/10.1007/s12083-017-0553-9;Article
Security and Privacy Analysis of Tree-LSHB+ Protocol;Wireless Personal Communications;;77;4;10.1007/s11277-014-1699-x;Xiaofei QianXinbao LiuShanlin YangChao Zuo;2014;http://link.springer.com/article/10.1007/s11277-014-1699-x;Article
Security in industrial IoT – quo vadis?;e & i Elektrotechnik und Informationstechnik;;133;7;10.1007/s00502-016-0428-4;Christian LesjakNorbert DrumlRainer MatischekThomas RuprechterGerald Holweg;2016;http://link.springer.com/article/10.1007/s00502-016-0428-4;Article
Seeing through the network: Competitive advantage in the digital economy;Journal of Organization Design;;6;1;10.1186/s41469-017-0016-z;Thorsten KochJosef Windsperger;2017;http://link.springer.com/article/10.1186/s41469-017-0016-z;Article
